{
  "session_id": "session_only_mbti_001",
  "created_at": "2026-07-04T13:45:00+08:00",
  "goal": "先看一下我的互动风格。",
  "inputs": [
    {
      "id": "input_text_only_mbti_001",
      "modality": "text",
      "created_at": "2026-07-04T13:45:02+08:00",
      "source": {
        "kind": "typed_text"
      },
      "quality": {
        "status": "high",
        "issues": [],
        "should_retry": false
      }
    }
  ],
  "signals": [
    {
      "id": "sig_only_mbti_001",
      "modality": "text",
      "type": "mbti_known",
      "value": "INFP",
      "raw_text": "我大概是 INFP。",
      "confidence": "user_reported",
      "dimension_hint": ["mbti"],
      "evidence": [
        {
          "kind": "user_report",
          "id": "input_text_only_mbti_001",
          "quote": "INFP"
        }
      ],
      "safety": {
        "usage": "用于 MBTI-style 互动偏好参考",
        "must_not": ["官方测评结论", "高风险筛选"]
      }
    }
  ],
  "unresolved_questions": [],
  "safety_events": []
}
